Comments,Comment Upvote,Time
What a wonderful message! If this message cannot change or save a person means...any religion in this world cannot save a person...believe Jesus is the unchanging Lord and Saviour of humanity....,1,3 years ago
AMEN TO THIS PRAYER ️ GLORY BE TO THE LIVING GOD JESUS CHRIST OF NAZARETH AMEN ,9,2 years ago
Amen glory to God.,44,4 years ago
"Oh, how I miss this man of God! I still love to hear his messages that touch the world's hearts for all of God's children. Thank you, Father God and Your Son Jesus for Billy Graham the love He had for You. The message you passed on to him to lead us to be saved by your Mercy and Grace. You are and will forever be a merciful and gracious Father, Son and Holy Spirit. May Billy Graham rest in your eternal glory as he was a true messenger. Praise be to your Glory.",1,2 years ago
God said give me your troubles give me your problems give me your worries and I will give you peace and rest.,1,3 weeks ago (edited)
Beautiful Messages As Always!,1,2 years ago
Love some Billy Graham. He is missed!,3,2 years ago
"inspired by Billy, and his delivery of THE WORD time and time again over the years",1,1 year ago
I pray that we shall not be left behind in Jesus Name Amen,8,3 years ago
Amen  God forgive me of all my sins,1,2 years ago
Powerful and beautiful words,1,8 months ago
"I'm Catholic and this is a great man, he lived his faith.",1,1 year ago
 good evening all  when I was growing up when the Billy Graham Crusaders would watch them,1,1 month ago
"Thank you Lord for loving us and your mercy on a sinner like me, thank you for your unchanging nature.",1,6 months ago
Lord forgive me for my sins that includes everything show me mercy..amen,8,4 years ago
God bless all people.  Amen ,1,3 months ago
I love his speech more than any other person's speech,1,2 years ago
This video of Billy Graham touches my heart every time I watch it. Everything so true… brings tears to my eyes. Thank you ,1,3 years ago
Amen ️️ praise Johava God and Jesus Christ our Lord and Savior.,1,2 years ago
Thank you Man of God ur message   inspired to me ,1,1 year ago
I wish I could've attended a sermon given by Pastor Billy Graham. What a man.,99,4 years ago
"God is good,  he is the best  there is,  Amen",1,1 year ago
Whenever i listen i feel the blessings of Lord. Great man of God,1,2 years ago
"Our Lord forgives n forgets....
Holy be dy Name....Amen.",2,2 years ago
"I love Billy Graham's  and all his sermons,he inspired the world, .I'm very 
much Thankful  to God for him,I know that he is in heaven now,I love
watching all his videos ang it helps me to grow my espiritual  life as a Born Again Christian here in the Philippines, I owe this so much. Thank you so much!God bless you all",1,3 years ago
Thank you Brother Graham. What a Blessed Anointed Christian.,1,2 years ago
This literally brought me to tears. The Lord is so Good and my prayer is that those I come in contact with and are close to my heart accept Christ into their hearts. God Bless!,12,4 years ago
Amen thank you my God Jesus Christ has save me and I have sin against you. Every day I repent my sin to you my mighty God,3,2 years ago
"Dear Lord, I thank YOU for everything you did and do for me. I thank YOU for this life and I recieve and accept you as my Lord and Saviour, because IT IS YOU WHO DIED ON THE CROSS for my sinns. 

In love, I AM YOUR child and I belong to YOU Jesus. YOU are the same, yesterday, today and tomorow. ",1,7 months ago
"LONGING

I long for you Oh Father God
With my entire being",1,2 years ago
"When I stand there, I'm not going to ask for judgement ..I'm going to ask for mercy!""",1,6 months ago
"Oh lord we ask have mercy on us these tough days! May all people seek your grace & realized that you’re the only way, truth & life.",1,5 months ago
"Thank you Jesus....
God given message from the Man of God",12,3 years ago
"Jesus clearly said ""I am the Way, the Truth and the Life""  No one sees the Father, but by Me!  This is absolute Truth that will never change!",1,2 years ago
"Thank YOU,and we you thank you and your family ",2,2 months ago
"Jesus Christ healed me! This is my story about my healing!I was extremely ill! I had diabetes and kidney failure, which urgently requires dialysis! I prayed to God to heal me, not for me, because I don't deserve it, but for my little children, who were left without a mother! in exactly that day, in which I prayed, the Lord healed me! I suddenly felt the pain in my kidneys go away, as well as the dryness in my mouth (diabetes). I'm a new women now! I thank the Lord for His mercy and love for us!!!!!!",1,7 months ago
There is power in his name,1,1 year ago
"AMEN.This is most POSITIVE video I've seen today. I'm using my time off work to pray more. I'm not alone; HE is with me. I'm calm, relaxed, & not stressing/worrying about shit. GOD DIVINE has my back......",1,2 years ago
"I'm in the middle of the familiar storm and it's hard, painful but GOD is with me and in control. No matter what happen around myself I'm choosen, blessed, loved for God  If God is with me who can againts me. Hallelujah ",8,3 years ago
God loves us and He never changes Amen ,3,2 years ago
God first in every step in our lives,4,1 year ago
Thank You Lord God...,2,2 years ago
Yes I agree God will never changed but we must be change in the name of Jesus Christ amen and amen Hallelujah,1,1 year ago
A message for 2020 have mercy on us Lord.,1,6 months ago
Absolutely powerful,8,3 years ago
Amen God bless you have a blessed day,2,2 months ago
"i needed this, thank you. I hope many will see this. I will try my best to spread the word",1,1 year ago
Fantastic message of Gospel ,2,2 years ago
GOD Loves us.We are special to HIM.,1,1 year ago
Powerful words that hold the key to a life in relationship with a wonderful God,1,1 year ago
Praise the LORD,10,3 years ago
Am so blessed when I listening this,1,2 years ago
Praise the lord ️,1,3 years ago
"AMEN, BROTHER, JESUS SAVES, JESUS IS THE PRINCE OF PEACE, THE LIGHT OF THE WORLD, AND THE TRUTH. I LOVE JESUS AND JESUS LOVES ALL! ",1,8 months ago
GLORY GLORY GLORY GLORY GLORY GLORY GLORY GLORY GLORY!!,1,1 year ago
"Amen , Thank you for your grace and mercy my lord JESUS",2,4 months ago
I serve the unchanging God... praise the Lord.,5,4 years ago
"Jesus ,help me to overcome my fears and doubts and to trust you",1,1 month ago
"I have listened to this SOOOOO many times I never get tired of it. Pastor Billy Graham spoke the truth. Thank GOD WE HAVE SUCH A FORGIVING ,CARING, JUST, AND A GOD OF LOVE .",1,13 days ago
"God you know all my sins, you have brought me through deep water, and I don't understand why, 
Lord I thank you and love you, in Jesus mighty name,Amen",1,3 years ago
The hair on my skin stands up each time I hear Billy Graham speak.I can only imagine what it must have been to hear the apostles preach..... ,1,1 month ago
"Powerful message, love this, the word of God is timeless.",1,2 years ago
AMEN... AMEN...Thanks Father God for your mercy thanks for everything in my life ..Thank you for not abandon me .. Have your Hands on every one .,7,4 years ago
Amen hallelujah praise lord Jesus Christ,2,1 year ago
Lord Jesus forgive me for my sins and come into my heart. I make you my lord and savior,1,1 year ago
"POWERFUL INDEED!!!!!! It’s miraculous that this wonderful man of God, chosen to lead others to Christ, is STILL affecting lives today! I pray, in Jesus name, that these sermons will continue to change lives through the many videos available on YouTube. I PRAISE–YOU FATHER GOD–in Jesus name, for the work YOU did through Billy‘s life. The many thousands, whom gave their lives to you, FATHER GOD, because they “surrendered all”. And certainly because Billy Graham was chosen by YOU, LORD, to do a mighty work in this world and especially because he indeed, “surrendered all”. Hallelujah!! PTL forever!!!",1,2 years ago
"He will never change, so we can change to be more like Him. We will never be Him, but we can grow to become more loving and caring and  able to reach out to help others. We serve a mighty God.",1,2 years ago
"Jesus is the same yesterday,  today and forever. He is the way, the truth and the life. O praise the Lord,  O my soul,  praise his holy name   hallelujah ",1,8 months ago
"Lord Jesus have mercy on me,,I confess you as my personal lord and savior",10,4 years ago
TRUE WHAT HE PREDICT.AMEN,1,7 months ago
Thank you Lord Jesus for what you did for us on the cross... and I Love you too!!! ,2,1 year ago
Rest in peace daddy.. I know your with the LORD..,2,5 months ago
God allow us see the grace through the blood of Jesus each day That's powerful along ... Jesus die for we can see the grace of God for he can allow his words to guide us daily,1,2 years ago
Amen to the Lord ..hope.. love .joy peace ..Faith,2,1 year ago
"forgive me Father. for I am a great sinner I've done the worst.. forgive me Jesus I need to feel your love. heal me, change me in Jesus name Amen",3,4 years ago
Have mercy on me God... I ask this in your Son's Holy Name... Amen.,1,1 year ago
AMEN️️Praise The LORD AMEN️️,1,1 year ago
"An overwhelming reaction to this grace of God is to praise him to praise him and song but he doesn't want us to do it alone. He enjoins angels, son, Moon, and all that who dwell in the time and space to praise our god of Grace for his goodness. We hear similar words in the communion liturgy therefore with all the Angels and Archangels and all the companies of Heaven We laud and magnify your glorious name indeed, all of creation can join in the praise of our God",1,11 months ago
"When God speaks through a choice vessel like Billy Graham,  you know God is speaking when them words can hit your heart and make you cry. Thank God for Your truth. Please save souls Jesus and heal the broken hearted  souks. In Jesus Name, Amen ",1,1 year ago
This is so important because of what we as a world is going through now. I pray that during this time people return to God. He is waiting for all of us.,3,5 months ago
One of the heart changing message ️,60,3 years ago
This is pure joy thank you for sharing,1,1 year ago
In JESUS name AMEN,1,2 years ago
Praise the lord  amen ️,1,11 months ago
"God loves you, if you seek him you will find him, he hears you,  he may not answer right away but he is there ready for you when you are ready for him",1,5 months ago
Thank you My Lord for your mercy and forgiveness ,1,2 years ago
God bless all the listeners,35,4 years ago
Yes my lord my Jesus Amen,1,2 years ago
Oh...what a great speech,1,2 years ago
Powerful ️,1,3 years ago
Oh! Lord in the name of Jesus! Please forgive me for my sins. Watch my children. Amen,1,2 years ago
He's My Inspiration,1,8 months ago
Love this man!,14,3 years ago (edited)
Hallelujah Amen ,1,11 months ago
"God Bless this messenger of Christ, pray for us in Heaven Rev Graham for a broken world needs repair..",1,1 year ago
Thank you JESUS,1,2 years ago
"Jesus....please forgive me for all my anger, hate, greed, addictions, and sins... Baptism me in your grace and mercy. Bless those who seek your face. I need you, Jesus. We need you, Jesus!",1,6 months ago
"""THANK YOU JESUS FOR THE CROSS ! AMEN & HALLELUJAH! ",1,3 years ago
"Amen, Lord God please watch over all of us and keep all of us safe, we need you, Thank you so much God the Father, Jesus Christ, and everyone and everything holy and heavenly for all the amazing things that all of you have done and that you do for everyone and everything, I love all of you, I love You so much God, In Jesus Name, Amen",27,4 years ago
It's easy to tell when the spirit of God is using someone to speak because when they speak it's like nothing you have ever heard before there is undeniable power in those words and may the Lord bless the ears which hear these words to make a difference in their lives..,1,3 years ago
I believe in you God. Help us!,1,3 years ago
Amen Jesus is King God bless️️,1,3 years ago
Jesus I love youu  I trust youu,1,2 years ago
Billy Graham my best personality on earth . Please pray for me that one day I can become like him. I took and following his path to serve Jesus. Please bless me and pray for me,1,2 years ago
Amen Jesus is King God bless️️,3,4 years ago
This is so good,1,2 years ago
"GOD FORGIVE ME O LORD OF MY SINS, DO NOT LET ME BE TEMPTED AMD DELIVER ME AND MY FAMILY FROM ALL EVIL! IN JESUS NAME I PRAY ALL OF THIS AMEN!️",4,2 years ago
Lord Jesus Christ hear our prayer to save us forgiveness in my sins against us.Amen,1,3 months ago
Yes He is the Only One Father have Mercy on us this world. Amen,1,2 years ago
"Thanks for uploading, May God bless you!!",2,2 years ago
Amen praise the lord,10,4 years ago
Woooooow. Have me chills fantastic,1,2 years ago (edited)
Such a nice sharing,1,2 years ago
"And today is the day...Wake up America "" the truth is unfolding before our eyes. To change the world  you have to start with yourself ",1,6 months ago
Halleluja!,2,3 years ago
Thank you Lord ,1,1 year ago
"Amen. Please forgive me for all my sins Lord Jesus Christ  i accepted You as my Lord and  Saviour . You are the only way , the truth , and the life ,",5,4 years ago
Glory Glory Glory to Holy God Amen Hallelujah hallelujah hallelujah ,1,7 days ago
Jesus Christ is our saviour ,1,1 year ago
Only Jesus can save us there Power in His Name .God is the same yesterday today and forever.  Amen,1,3 years ago
I defenitely agree !. GOD ALMIGHTY is omni present & omni potent  ........  AMEN & AMEN !!!.,1,1 year ago
 Reverend Billy Graham,2,1 year ago
This is powerful,3,4 years ago
"Lord Jesus Christ please forgive me for my sins. Lord JESUS please teach me to seek peace, hope, good and love.",1,2 years ago
Walk my shear Faith ,1,2 years ago
Hallalujah God's unchanging Hand. Glory,2,2 years ago
"I truthfully loved Billy, I miss him, no one else can speak like him with that passion ️",1,1 year ago
This Blessed man changed my life again in 2003 by his commanding Spiritual talk.PRAISE THE LORD,1,2 years ago
AMEN Thank you Lord Jesus may God bless you pastor,8,4 years ago
"Father God, I need your mercy, grace, and forgiveness. My righteousness is that of filthy rags. Only Jesus Christ of Nazareth can cleanse me without spot or blemish. Hallelujah to the Lamb of God my Lord and savior Jesus Christ of Nazareth ️️",1,2 weeks ago
This is  really most inspired me and I  hope people watched  belive in god and never give up,1,1 year ago
Amen! The world needs to be shaken today!,1,3 years ago
I will change according to your will lord help me to do it father holy spirit Amen,2,2 years ago
 AMEN!!! ,1,2 years ago
God bless and guide to all form right way ️️,24,4 years ago
God wants you to love him as much as he loves you.,1,8 months ago
Amen glory to God,1,6 months ago
"Accept the Scripture by faith.
Powerful.",1,10 days ago
God is with me I don't afraid of anything,2,2 years ago
"Thank you, Billy Graham I believe you have a good time with the Lord in Heaven . Thanks for all  preaching",1,2 years ago
God forgive all my sins. I know I am forgiven as I ask. Thank you God for your mercy and love. thank you for forgiving me.,60,4 years ago
Dear Lord please forgive me of all my sins and help me to be a better person and do whats pleasing and right in your eyes. Thank you for your undying grace every day. Amen.,1,7 months ago
Praise the lord ️️️️️,1,1 year ago
"Amen Amen Amen
Hallelujah
Thank you Jesus",1,1 year ago
Our Christian Nation needs this now more than ever. GodSpeed to all.,1,2 years ago
"Lovely fire of the Holy Spirit in this message.
Praise the Lord God always!  
He is so good all the time! ",1,1 year ago
I love this amen,4,3 years ago (edited)
It’s what you do thru u adversity that defines who you really are .. depend on a higher power ,3,2 years ago
Wow.. its wonderful message,--,12 days ago
"God is my Shepherd l shall not lack, 
I surrender to you my sweet God creator of heaven and earth in Jesus christ name amen ",1,2 years ago
"For those who want to know the scriptures used in the video (that I'm aware of). 
1:04 Malachi 3:6
2:39  Ephesians chapter 2.
3:21 Isaiah 40:8",1,3 months ago
from today i surrender myself to god...BILLY Graham   is so much passionate about god,1,1 year ago (edited)
Glory to God ... what a mighty God we serve Ephesians 1:17 .... To God be the Glory ....  Isaiah 55:7 ... 2 Thessalonians 3:16 ...,3,3 years ago
Billy Graham had such a way with words. You can hear the passion in his heart. You knew he truly loved God. This message is a great reminder that God never changes. That God loves us always and forever. I've been going through some tough times last year just like a lot of folks and I know God is walking with me. I know God loves me and I love him. Thanks be to God,1,2 years ago
I love God and seek for his forgivness!,2,1 year ago
Glórias a Deus!,1,2 years ago
"MY DEAREST1....... THANK UUU
EVER SOOO MUCH 4 THESE
Spiritual Videos.. WE'RE BLESSED.
Praise HIM & GIVE THANKs",1,3 years ago
Amen so powerful ️,1,2 years ago
I pray for the salvation of lost sinners all over the world!!!,4,4 years ago
True words ️️ touch my hourt,1,3 years ago
"God is coming 
Keep faith",1,1 year ago
His speaking the truth.  And his with the Lord.,1,2 years ago
Praise the Lord,1,2 years ago
"God does not change .
God extends his Mercy.
Be holy for I AM HOLY Saith the LORD.",1,2 years ago
I always come back thank you Billy,13,4 years ago
Powerful sermon....,1,1 year ago
Thank you God that you washed away my sins ty Lord for your cross without you I’m nothing..,3,6 months ago
Thankq Jesus️,1,2 years ago
"What a sermon
I would love to say something very profound, but I'm lost for words Jesus saves amen",--,2 years ago
Glory to God,1,1 month ago
This is one of the most powerful sermons ever thank u GOD in Jesus name,5,4 years ago
Amen He is unchanging and forever true . King of all king's Lord of all Lord's ️,1,10 months ago
"Bless me o lord, and save me.",1,2 years ago (edited)
Great vedio amazing word of God God is unchanging there is no one like you God is this sinful world God is unchanging in his love thanks jesus for loving me great man of God billy graham love from Pakistan.,1,6 months ago
3:01 most wonderful thing to sleep with at night,--,1 year ago
God forgive me for I am a sinner. I know for by grace alone I am saved!,--,2 years ago
may God bless  you all and forgive your sins,1,3 years ago
Every single time I listen to this clip of Bill I am thankful to God that I received grace and mercy of God through His only Son Jesus Christ! And I lay down all my worries and impossible situation and truly thankful that I have Messiah who will do the job!,2,1 year ago
Whoever is reading this Please Do Pray For Me As I m in Great Depression ....Thus having a low Faith ,1,3 years ago (edited)
Amen! We are so privileged to be His children. God’s love is everlasting to everlasting.,--,2 years ago
Father Tank you your words please help me leads my heart' always ,1,1 year ago
"Absent from the body present with the Lord. 
Peace From London. ",1,3 months ago
Truly God doesn't change so we need to change to His own ways and Will. God have Mercy on Our Lives.,4,3 years ago
This man been inspiration always,1,3 years ago
HALLELUIYA AMEN AMEN AMEN,--,3 years ago
Yes Father I Donald Andrew Hernandez am a Sinner and ask you into my life as LORD and Savior. Thank you and God Bless ALL. Peace and Prayers Don Hernandez,1,3 years ago
"Were in that shake now the whole world is in a shake we the people have lost over a million people THIS...THIS is the time that all races of people MUST stand help an fight to overcome this,LOVE each other.I LOVE YOU ALL BROTHERS AN SISTERS OF THE WORLD.Godbless",1,3 years ago
AMEN! HALLELUJAH! THANK YOU YESHUA! THANK YOU FOR SHARING THIS AMAZINGLY BEAUTIFUL VIDEO OF BILLY GRAHAM! I GREW UP WATCHING BILLY GRAHAM! PRAYERS AND BLESSINGS SENT YOUR WAY TO YOU AND YOUR FAMILY AND FRIENDS!,1,2 years ago (edited)
"History repeats itself , Jesus stands true to His word , promise never changes
Godspeed to all forever and a day",26,4 years ago
"""Jesus Said I Am The WAY The TRUTH And The LIFE No Man Cometh To The FATHER But By ME""",1,1 year ago
Praise God,2,2 years ago (edited)
"Powerful, beautiful, true!",4,2 years ago
God Bless Billy Graham,3,9 months ago
"These  times have come now! Amen! Amen! Lord be with us all as we go through troubled times.... sickness, cancer,loss of jobs and finances,loss of loved ones, and help us all to love you and know you more than we ever knew we could. Love us Lord and save us! Our Heavenly Father Amen! And Amen! Thank you Lord....",1,1 year ago
"Glory to God, AMEN!",4,3 years ago (edited)
Blessings and good speech,1,9 months ago
Praise the lord,--,3 years ago
Billy Graham is an angel sent from Christ.,1,2 years ago
"Jesus please forgive me
I am unworthy of thy grace
Lord, forgive me 
I want to be drawn near to you again, O Lord",1,6 months ago
I need forgiveness everyday Lord thank you for loving me enough not to leave me the way you found me.  I’m glad that You change not in a world that forever changes I can count on You to remain the Same.,1,2 years ago
I love this message with whole my heart.,25,4 years ago
With gods grace we will all make it to the kindom of heaven,1,3 years ago
"Amen and Amen 
Thankyou Thankyou Thankyou Universe and spirit guides 
I am a new creature in Christ Jesus",1,2 years ago
"Amen, He was one true soldier of God. He made sense about everything he had to say about the Bible. He was blessed with the right words from our lord and savior Jesus Christ",--,1 year ago
God lives within me,1,2 years ago
"Amen God hasn't changes, thanks lord for your mercy and loves.",1,11 months ago
God Bless You All.,7,4 years ago
ONCE YOU SEE THE TRUTH YOU SHALL NEVER GO BACK ! ALL PRAISE TO THE FATHER THE SON AND THE HOLY SPIRIT . He has saved me from the worst of conditions as he has all of us . What a loving God we serve !!!,1,2 years ago
I have jesus  in my life...,1,2 weeks ago
Amen and Amen!!,1,1 year ago
AMEN!,1,2 years ago
"God help me always
I trust in you",2,2 years ago
HALLELUYAH!(PRAISE YE YAH!) Keep HIS Commandments or you can't make HIS Kingdom(Revelations 22:14).,3,3 years ago
I sure do miss this man.,1,2 years ago
"Jesus said, ""I tell you the truth, no one will see the Kingdom of God unless he is born again. I am the way the truth and the life, no one comes to the Father except through me. For God so loved the world that he give his only Son that whoever believes in Him shall not perish but gain eternal life. For God did not send His Son into the world to condemn the world but to save the world through Him. For all have sinned and come short of the glory of God. For the wages of sin is death but the gift of God is eternal life through Jesus Christ our Lord and all who call upon the Name of the Lord will be saved. ""John 3v3v21, John 14v6 Bible",2,6 months ago
Amen hallelujah ️,30,2 years ago
"God forgive me all my sins, save my soul and my spirit,,, show me marcy ohh father,,,, malachi 4 :2 show me yo light in my way,,, i love you Lord Jesus, may your name be Glorified amen ",2,2 years ago
"If you're having a bad day, know that God loves you",1,1 year ago
"Jesus has never died, he alive since  ",6,3 years ago
"I miss his powerful preaching.
""Work out your salvation with fear and trembling""",--,2 years ago
Praise the Lord,--,2 years ago
"For God so loved the world that he gave his only begotten Son that whosoever believeth in him should not perish but have everlasting life.  Amen 
️‍",--,2 years ago
This is one of the moments when real men cry,1,11 months ago
THE GREAT GOD LOVES YOU ALL,2,2 years ago
Utterly brilliant.,8,3 years ago
Amen Jesus is my lord and Savior,1,1 year ago
Praise the lord,1,1 month ago
"Powerful and kind God gave us a way out. He brought light into our darkness, the spirit of the living God I ask you to forgive me for my sins and help me remain in you even as the enemy works threw people to try destroy me to this day. I put my trust in you jesus and no you will see me threw. For after every dark night there's a bright day. You are the only thing stable that we can stand on you alone father. I love you jesus ",1,2 years ago
Praise the lord,--,2 years ago (edited)
"Yes, we must accept the change. Amen.",1,2 years ago
Thank you god I receive you god I have so many questions please guide me Lord i need you lord ️,12,4 years ago
The best preach I ever heard.,--,3 years ago
Help us Lord,--,3 years ago
"3:34 “there are a lot of things in this bible I don’t understand” that’s powerful. It’s ok to NOT understand the whole bible, it’s pretty complex. The best and most important thing to understand is the story of Christ",2,1 year ago
AMEN!,2,1 year ago
"After followed  Christ and Baptist, i found Billy  Graham preaching in you tube. it seem God  sent me people to build my faith. Thank you Mr Billy Graham. I like to see u in Heaven where you are now. Amen ",1,2 years ago
"Great sermon then ,& a great sermon now ,GOD HAVE MERCY FOR ALL THE WORLD  THRU CHRIST  JESUS OUR LORD &SAVIOUR  VICTORY IN JESUS",8,3 years ago
The best speaker I have ever ever ever seen and heard. Wow.,1,2 years ago
"Pastor  Billy Graham
Pray the Lord 
God Bless you",3,2 years ago
"There is no good in me.  Lord forgive me and all those who seek your grace and mercy.  Bless us Lord, with change.  A change that will desire alignment with you and your word.  Bless us with strength of body and character and, clarity of mind to do your will in all things.  Bless us to recognize our brothers and sisters and lift them up to you that not one soul may be lost.  All for your glory!!!",2,2 years ago
