Comments,Comment Upvote,Time
Amen Brother.,--,11 months ago
Thank you my brother in Jesus mighty name Amen brother pleas pray for me and my family,1,2 years ago
"Mark 5: 19. Witnessing, Go home to thy friends, and tell them how great things the Lord hath done for there, and hath had compassion on thee️",7,4 years ago
"Christ jesus please, cleanse me from all my Sins , my sins are causing me  to sink deep into perdition right now . Have mercy on me son of David . give me a new chance to walk with you Lord. I know you have better plan for my life because you created me. Amen",--,2 years ago
We need another man like him !!! NOW,1,2 years ago
Amen Thank you  Amen Thank you I Lo you God ️,--,1 year ago
"I’m struggling and can’t stop crying , Iv been an addict for years and I grew up in a Christian house I used to believe but life has beat me so bad bad I can’t seem to have any faith anymore, but I can’t seem to forget , life is so hard I can’t understand why , my mind has been dark for years and for years Iv prayed so hard , crying out on the floor but to no avail ,im discouraged and don’t know how to feel better",1,3 weeks ago
"God never change, He has power to change all situations,  cast your  worries to God, call upon Him and count on God  who is  able, reliable and available  there is  hope for you",--,1 year ago
Amen please pray for My family,11,3 years ago
Thank you Billy you made things very clear to me example I don't understand everything in the Bible and you made it sound it's okay as long as I trust and believe what's in the Bible. You have no idea how good that makes me feel I feel relieved.,1,2 years ago
Oh what a joy i hav recieve the grace,--,3 years ago
Sometimes I can’t even remember how sinful I have been,1,1 year ago
"God restore my faith! I know I need you, help me to come closer to you",1,1 month ago
you dont need to know everything because faith is all you need.,--,2 years ago
Praise  almighty God amen,39,3 years ago
Please God have mercy on me ..Amen,1,4 months ago
"Save me GOD, that's all am asking",1,3 months ago
Amen thank you jesus,1,11 months ago
Praise the Lord,1,1 year ago
Powerful word for such a time as this.,1,6 months ago
Yes I agree with Billy Graham in the powerful name of Jesus Christ Amen.,30,3 years ago
Amen ️,1,1 year ago
"Jesus, I trust in you.",--,3 years ago
I Love Billy Grahams Preaching,1,2 years ago
"Every knee will bow to The Lord My God
Thank you Jesus The Christ, especially for The Spirit That Dwells from within, Praise the GREAT I AM,  
Aman and Aman",--,5 months ago
"Our mission is to know God and make him known to all
That's why he has send us into this world to proclaim the good news",--,2 years ago
Jesus Loves everybody Amen,26,3 years ago
Amen lord jesus hail to the lord jesus,1,1 year ago
Praise the lord amen,1,2 years ago
WE NEED YOU JESUS! PLEASE COME TO US,--,2 years ago
I need you God...,--,2 years ago
Glory!!,2,1 year ago
Amen and Amen. ,6,3 years ago
Amen️,2,10 months ago
Powerful,1,2 years ago
Amen thankyou Jesus,1,2 years ago
"God forgive me , im sometimes confused wen things are getting harder and harder I sometimes question myself if u see what I go through. Forgive me because im ungrateful person . I know you love me and im going to wait on ur time cz I know u never late . Give me faith to wait for ur voice ",1,5 months ago
This was a good man who brought thousands to the Lord. I really enjoy his early work when he was a young man.,1,1 year ago
I really love the way he teach us,16,3 years ago
"Sorry for the thing that i hate done in my life..... Sorry for not obeying my parents.... When I let my anger n depress let me to wrong way.. U are always there for me..... Thanks u for giving me a parents, thank u for knowing that i am not alone... Thanh u for your guidance n protection for all the past year",1,2 years ago
Amen thank you god bless,1,2 years ago
AMEN PRISE THE HEAVENLY FATHER AND HIS BELOVED SON JESUS CHRIST WHO DIED FOR ME HE IS MY EVERYTHING AND I LOVE HIM WITH ALL MY HEART AND SOUL MY LIFE I SHALL NEVER DENY YOU MY HEAVENLY FATHER ,2,1 year ago
Let us  turn away from sins  we need to follow Jesus so that we can be saved through him,--,2 months ago
"Almighty God , kindly have mercy on me and grant me ur grace through my faith in my redeemer and saviour Lord Jesus Christ. Amen. 
.",1,2 years ago
PRAISE THE FATHER GOD,14,4 years ago
"Thank you dearest Billy Graham, brother in Christ. Thank you for clear and precise message of the Gospel, and for staying true to your faith. May you rejoice in presence of the Lord as one of the very elect!",--,3 years ago
Not going to lie I was seven when I saw Billy Graham on TV and he led me to Jesus that day.,--,3 months ago
Praise Jesus the Messiah,--,3 years ago
Shalom God bless you and much love,1,2 years ago
Powerful,--,3 years ago
He is the greatest preacher ever,3,4 years ago
"ON THIS THANKSGIVING 2020, TO ME THIS IS SO FITTING.",1,2 years ago
So right.....So TRUE !!!,1,2 years ago (edited)
"Wonderful, true beautiful, Gods grace for us who truly believe!!",2,1 month ago
Amennn ,1,2 years ago
I thank you Jesus for dying on the cross for me. God is love. Mr. Graham was the best.,--,3 years ago
Thankyou Lord,11,4 years ago
"Can u upload more videos of speeches of Jesus love , sacrifice, kindness",1,2 years ago
"Forgiveness i'am sinner Lord  please Forgiveness  Lord  please give me your holly blood  lord wash  my life in my soul  Lord help  me please forgiveness   me im sorry Lord  i surrender my life to you  in my Soul .i need you Lord forever in my life in my Soul 
 In Jesus Christ Name Amem️️️️",--,11 months ago
Can you guys maybe please pray for my parents and grandparents to become saved?️,1,4 months ago
AMEN!!!,--,2 years ago
God is greatI love him to infinity...He has blessed my life and I'll be forever gratefulThank you God,1,1 year ago
Lord please forgive my sins and let me turn to u my savior,22,3 years ago
Amen but we can ask God to Forgive us. Even through repentance. May God Bless us all and call us who we have called us to be. God is Eternal everything in this world is temporary.,1,8 months ago
Praise the Lord,2,1 year ago
Thank u lord my God!!!!I am a poor sinner & offender. Thank u Mr. Billy Graham for ur wonderful speech.,1,1 month ago
"My captain 
Oh my captain 
My sail broken and the wind is against me
My spirit tired and I have no strength left in me",--,1 year ago
“HOW CAN A FINITE MIND LIKE MINE COMPREHEND AN INFINITE ONE” amen,--,2 years ago
Father God forgive me for my sins. I ask for you to take care of us all in these trying times Amen,17,3 years ago
"Oh how I long to be in Heaven with God the Father and his son Jesus. To be with all my animal solemates who have looked after me and loved me. To be free of my fear, anxiety, and depression. But God if it's your will let me do something for you while I'm still here. Please use me to spread your message of love. I am offering the remaining years of my life to you. Please Lord bless me by accepting my offer. Please let me live and die for Jesus. I feel so hollow, so empty now. I am asking you God in the name of your loving son Jesus to pour out your grace upon me, and change who I am. Save me so that I may help save others.  I accept Jesus as my Lord and Savior. Please accept me as your child, strengthen my faith. Do with me as you wish. I am now yours. Amen.",1,3 years ago
Lovely ,--,2 years ago
Amazing.. Thank you.,1,1 year ago
"Preach, Preacher!",1,2 years ago
"I Need the Grace of God, I need the Forgiveness of God.. Please Pray for me to let God forgive me for that I've being a sinner for all those past years, days, minutes... Lord Jesus Christ I need you for I am nothing without you please forgive me in Jesus name I pray.",1,1 year ago
"Thank you, God, for all of creation. Thank you for creating me and all the people in my life, past, and future. Father I want so much to quit smoking cigarettes. They are of no value to me, and are destroying your temple within me. Please give me the strength to overcome this bad habit.Father, thank you for sacrificing your son to save all of us . Father I pray for all those on here giving you glory and in need of help. Thank you I love you ",13,3 years ago (edited)
Amen  ,1,4 days ago
"Praise the lord  praise the lord  praise the lord  amen  amen  amen ,,,, I am blessed  amen ",1,4 months ago
"Lord I pray that you forgive me for all my sins and help me Holy Spirit to live a holy life, give me your strength to stand up against any temptation the devil bring before me, with your mercy and grace Lord will it be so, for I I'm weak and you my God is my strength, I worship you my Lord Amen",1,1 month ago
RIP ,1,1 month ago
We need God now more than ever,2,2 years ago
AMEN,22,3 years ago
amen brotha glory be to god always and forever i love yall he loves yall more tho,1,3 months ago
Amen.i believe lord god.thank you soo much lord god.keep my family safe lord god.i love you soo much lord god.️️️,--,1 month ago
Amen God never change humans have to change in Mighty Jesus Name Amen Hallelujah...........,1,2 months ago
Amen ,--,2 years ago
"In a world that is changing rapidly before my eyes, I am comforted knowing that some things will never change. The most meaningful things in life seem to be those things. GOD, family, and faith.",1,1 day ago
WoW!!!!!!,27,3 years ago
Something’s remain…… I am the way said Jesus… Gods way is the only way to Salvation and live in a wholesome marriage. To live a happy healthy life we live this life for are God. I AM THE WAY.. ️,1,3 months ago
Amen and pray for me ️,1,1 year ago (edited)
Lord please forgive me for all the wrongs things I’ve done and all of the wrong things I’ve said and all of the people I hurt amen.,1,3 years ago
2021: a lot of signs that Judgment day is near and I’m ready️,1,10 months ago
"Oh Lord, Your love always spreading upon me all the time. Thank You Jesus for Your mercy and blessings.
In Jesus name. Amen.",1,2 years ago
Amen  Lord,16,4 years ago
"Billy Graham is Heaven 2.0 to all words, all humans and god... God has the respect of love... god loves you, god died on the cross for us, god bless everyone.",1,7 days ago
AMEN AMEN AMEN HALLELUJAH ️️️️️️️️️️,--,2 years ago
Lord please forgive me forgive me for my sins I pray for mercy salvation the grace of God,1,2 years ago
Jesus Christ I believe that you are the way️ the truth and the life,1,6 months ago
"When I was teenager .. I realy near in Gods arm .. im a song leader of our church . Im a leader also in youth  but ill change ... i forgot him   sorry God   , sorry .. I repentant all I mistake ive done  .. im here . Hope your door is still open for me",--,3 years ago
I know every person wishes God would just give us a real hug. Imagine that. Every worry and concern would be washed away by just an embrace by our Lord.,41,4 years ago
Listening   waiting to witness the Discovery and the Great Exploration  ...  ... God bless you Valorous Crusader  .  I am interested in your Immortality and all ... Southern Cross ️ ,--,1 year ago
"️
AMEN!!!!!!!",--,1 year ago
"We all feel some type of way when we hear things like this, it’s because deep down you know god is real",2,1 month ago
AMEN AMEN,--,1 year ago
Just a great man.,1,2 years ago
"Pray with me: Father, forgive my sins, write my name in the book of life, I believe and recognize that Jesus is my Savior, amen.",3,3 years ago
Fro. The day I follow lovely jesus . really my life changed to very peaceful . thanks jesus and the god . for sending jesus,1,8 months ago
"Jesus please forgive me from my all sin , i am sorry my lord for my all bad thinks ",1,1 year ago
AMEN,--,2 years ago
"I felt like God forsaken me, and shut me out .. also thought he hated me for mistakes I’ve made, I truly feel I don’t deserve life . I got into the way of will and I felt directed to hell but i remember someone told me in the Bible it says “plant first , water then grow with Jesus.. that’s why God didn’t talk to me or listen to me because I didn’t even plant .. I wasnt willing to sacrifice my sin and bad doing.. I look back and all I see is destruction from sin, but God helped me and saved me again.. because I confessed and turned away now I’m growing with Jesus as he is in my heart .",1,1 year ago
We must change that is true. God bless everyone ,2,2 years ago (edited)
"Jesus son of God is the true God who save us to fullness of lifeI love to follow my Jesus son of God as God, Amen",10,4 years ago
Amen ️️,1,2 years ago
"1 Peter 4:8️

Above all, love each other, for love covers a multitude of sins",1,5 months ago
God please I have broken so many promises Lord may u pardon me today renew my spirit in u I want to get closer to u Amen,--,2 years ago
AMEN AMEN AMEN,1,1 year ago
Powerful,1,1 year ago
